query,rank,language,url,title,snippet
"""Write"" ""once""",4,en,https://stackoverflow.com/questions/34988277/write-once-in-linux-kernel-lists,c - WRITE_ONCE in linux kernel lists - Stack Overflow,"Jan 26, 2016 · The first definition you refer to is part of the kernel lock validator, aka ""lockdep"". WRITE_ONCE (and others) don't need special treatment, but the reason why is the subject of another question.. The relevant definition would be here, and a very terse comment states their purpose to be:. Prevent the compiler from merging or refetching reads or writes."
"""Write"" ""once""",5,en,https://medical-dictionary.thefreedictionary.com/Write+once,Write once | definition of Write once by Medical dictionary,"Drug slang A regional street term for PCP Informatics (1) Computer worm, see there. Cf Computer virus (2) Write-once/read-many—WORM Permanent computer memory—e.g., CD/ROM—for efficient storage of data—circa 700 Mbyte—e.g., medical and lab records"
"""Write"" ""once""",6,en,https://www.hubstor.net/write-read-many-worm-compliant-storage/,What is Write Once Read Many (WORM) Compliant Storage ...,Write once read many compliant storage gives organizations a way to secure information in a form that no one can tamper with. This can happen with something as simple as a CD-R or with software-driven cloud storage.
"""Write"" ""once""",7,en,http://writeitonce.com/,Welcome to the Write It Once website!,"Welcome to the Write It Once website!. The Write It Once software solutions from JTA Consulting are the ""Virtual Assistants"" for the Small Office / Home Office and Small Business environments.. In a Nutshell - The Write It Once programs eliminate the re-typing of data into your business applications."
"""Write"" ""once""",8,en,https://beeware.org/,Write once. Deploy everywhere.— BeeWare,"Write once. Deploy everywhere. Write your apps in Python and release them on iOS, Android, Windows, MacOS, Linux, Web, and tvOS using rich, native user interfaces. Multiple apps, one codebase, with a fully native user experience on every platform."
"""Write"" ""once""",9,en,https://www.techopedia.com/definition/27405/write-once-read-many-worm-data-storage,"Write-Once, Read-Many (WORM) - Techopedia.com","Write-Once, Read-Many (WORM) is a data storage technology mechanism that stores unerasable and/or unmodifiable information after it has been written on a drive. The data is stored on WORM devices. These device disks store data in a non-rewritable format to prevent users from accidentally erasing or altering sensitive information. WORM is also ..."
"""Write"" ""once""",10,en,https://security.stackexchange.com/questions/96230/convenient-write-once-media-to-attach-to-a-computer-a-usb-stick-or-device,storage - Convenient Write Once Media to ... - Stack Exchange,"What is a convenient write once media to use with a Computer, preferably via the USB interface. I often see this use-case in several ways: I have a server whose logs need to be on a medium that ..."
"""Write"" ""once""",11,en,https://dpbestflow.org/data-validation/write-once-media-validation,Write-once Media Validation | dpBestflow,"Write-once media like CD, DVD or Blu-ray disc is perfect for this, since files on write-once media can't be altered once the disc has been written. You can also do this with hard drives, but only if you don't ever update the files once you have created the checksum. Once you make any change at all to the files, you invalidate the checksum."
"""Write"" ""once""",12,en,https://encyclopedia2.thefreedictionary.com/Write+once%2c+run+anywhere,"Write once, run anywhere | Article about Write once, run ...","Looking for Write once, run anywhere? Find out information about Write once, run anywhere. Storage media that can be written to but not erased. WORM and CD-R disks are examples. Contrast with rewritable. See WORM and CD-R Explanation of Write once, run anywhere"
"""Write"" ""once""",13,en,https://encyclopedia2.thefreedictionary.com/write+once,Write once | Article about write once by The Free Dictionary,write once Storage media that can be written to but not erased. WORM and CD-R disks are examples. Contrast with rewritable.See WORM and CD-R.
"""Write"" ""once""",14,en,https://acronyms.thefreedictionary.com/Write+Once%2c+Read+Occasionally,"Write Once, Read Occasionally - How is Write Once, Read ...","WORO - Write Once, Read Occasionally. Looking for abbreviations of WORO? It is Write Once, Read Occasionally. Write Once, Read Occasionally listed as WORO. Write Once, Read Occasionally - How is Write Once, Read Occasionally abbreviated? ... Write Once, Read Occasionally; Write once, run ..."
"""Write"" ""once""",15,en,https://superuser.com/questions/771945/is-there-such-a-thing-as-a-worm-write-once-read-many-sd-memory-card-or-usb-fla,Is there such a thing as a WORM (write-once-read-many) SD ...,"Do you know if exists a write-once-read-many (aka: WORM) USB flash or SD memory? I need an electronic write once memory to meet law requirements for storing sensitive data, and I want an alternative to my actual solution of CD-R discs. I found that SanDisk produced some WORM SD card, but now this kind of card seems to be out of production."
"""Write"" ""once""",16,en,https://medium.com/androiddevelopers/write-once-run-everywhere-tests-on-android-88adb2ba20c5,"Write Once, Run Everywhere Tests on Android - Android ...","At Google I/O this year, we launched AndroidX Test, part of Jetpack. Today we're happy to announce the release of v1.0.0 Final alongside Robolectric v4.0. As part of the 1.0.0 release, all of…"
"""Write"" ""once""",17,en,https://goinswriter.com/tips-writing-book/,How to Write a Book: 10 Ridiculously Simple Steps,"You write a book by deciding first what you're going to write and how you're going to write it. Staying motivated: Once you start writing, you will face self-doubt and overwhelm and a hundred other adversaries. Planning ahead for those obstacles ensures you won't quit when they come."
"""Write"" ""once""",18,en,http://grandslamscorebooks.com/,Welcome to Grand Slam Scorebooks,*This is a Write-Once TM feature that eliminates having to do continually flip the book over and then rotate the book around 180 degrees because it's upside down. (Write-Once is about simplifying scorekeeping by eliminating having to write the same things or do the same things over and over and ...
"""Write"" ""once""",19,en,https://dzone.com/articles/write-once-deploy-anywhere,"Write Once, Deploy Anywhere - DZone Cloud","Write Once, Deploy Anywhere ... I can write a little script that checks for that memory leak and reconstitutes the code on a regular basis. So I never consume too much memory. If I had run that ..."
"""Write"" ""once""",20,en,https://www.yourdictionary.com/write-once,Write-once dictionary definition | write-once defined,"write-once definition: Adjective 1. (computing) of a type of storage technology in which data, once written, cannot be erased or modified ..."
"""Write"" ""once""",21,en,https://thewritepractice.com/once-upon-a-time-pixar-prompt/,Once Upon a Time: Pixar Prompt - The Write Practice,"Pixar tells perfect stories. Teams of writers spend years writing them, rewriting them, and rewriting them again. They are perfectionists of story. That's why I was so excited when my friend Brandon Clements sent me this amazing list of storytelling rules from the writers at Pixar. I picked out this one that provides a simple, interesting story structure: #4: Once upon a time there was ___."
"""Write"" ""once""",22,en,https://venturebeat.com/2019/07/15/twitter-rebuilds-website-for-write-once-run-everywhere-philosophy/,"Twitter rebuilds website for 'write once, run everywhere ...","Jul 15, 2019 · Twitter's goal was thus one website that can deliver the best experience possible to each person — a ""write once, run everywhere"" philosophy. Twitter.com now only downloads and runs code ..."
"""Write"" ""once""",23,en,"https://en.wikipedia.org/wiki/Write_once,_run_anywhere","Write once, run anywhere - Wikipedia","Write once, run anywhere (WORA), or sometimes Write once, run everywhere (WORE), was a slogan created by Sun Microsystems to illustrate the cross-platform benefits of the Java language. Ideally, this meant that a Java program could be developed on any device, compiled into a standard bytecode, and be expected to run on any device equipped with a Java virtual machine (JVM)."
"""Write"" ""once""",24,en,https://about.gitlab.com/2019/06/13/google-gitlab-serverless-webinar/,"Write once, deploy anywhere: Containerized applications on ...","Write once, deploy anywhere: Containerized applications on modern serverless platforms Containers, serverless, and microservices, oh my! Cut to the chase and learn how to write apps once and deploy anywhere with emerging technologies."
"""Write"" ""once""",25,en,https://www.thefreedictionary.com/Write+once,Write once - definition of Write once by The Free Dictionary,"Write once synonyms, Write once pronunciation, Write once translation, English dictionary definition of Write once. v. re·wrote , re·writ·ten , re·writ·ing , re·writes v. tr. 1. To write again..."
"""Compilers"" ""Principles""",1,en,https://www.amazon.com/Compilers-Principles-Techniques-Tools-2nd/dp/0321486811,"Compilers: Principles, Techniques, and Tools (2nd Edition ...","Compilers: Principles, Techniques and Tools, known to professors, students, and developers worldwide as the ""Dragon Book,"" is available in a new edition.Every chapter has been completely revised to reflect developments in software engineering, programming languages, and computer architecture that have occurred since 1986, when the last edition published."
"""Compilers"" ""Principles""",2,en,https://www.amazon.com/Compilers-Principles-Techniques-International-Economy/dp/9332518661,"Compilers: Principles, Techniques, and Tools 2nd ... - amazon.com","Compilers: Principles, Techniques, and Tools 2nd By Alfred V. Aho (International Economy Edition) [Alfred V Aho] on Amazon.com. *FREE* shipping on qualifying offers. DescriptionCompilers: Principles, Techniques and Tools, known to professors, students, and developers worldwide as the Dragon Book"
"""Compilers"" ""Principles""",3,en,"https://en.wikipedia.org/wiki/Compilers:_Principles,_Techniques,_and_Tools","Compilers: Principles, Techniques, and Tools - Wikipedia","Compilers: Principles, Techniques, and Tools is a computer science textbook by Alfred V. Aho, Monica S. Lam, Ravi Sethi, and Jeffrey D. Ullman about compiler construction.First published in 1986, it is widely regarded as the classic definitive compiler technology text.. It is affectionately known as the Dragon Book to generations of computer scientists as its cover depicts a knight and a ..."
"""Compilers"" ""Principles""",4,en,https://www.ebookphp.com/compilers-principles-techniques-and-tools-2nd-edition-epub-pdf/,"Download Compilers: Principles, Techniques, and Tools (2nd ...","Note: If you're looking for a free download links of Compilers: Principles, Techniques, and Tools (2nd Edition) Pdf, epub, docx and torrent then this site is not for you. Ebookphp.com only do ebook promotions online and we does not distribute any free download of ebook on this site."
"""Compilers"" ""Principles""",5,en,https://www.goodreads.com/book/show/703102.Compilers,"Compilers: Principles, Techniques, and Tools by Alfred V. Aho","This introduction to compilers is the direct descendant of the well-known book by Aho and Ullman, Principles of Compiler Design. The authors present updated coverage of compilers based on research and techniques that have been developed in the field over the past few years."
"""Compilers"" ""Principles""",6,en,https://suif.stanford.edu/dragonbook/,"Compilers: Principles, Techniques, and Tools (Dragon Book)","This website serves as a supplement to the 2nd Edition of the textbook Compilers: Principles, Techniques, and Tools (commonly known as the Dragon Book). The new Dragon Book has been available since September 2006."
"""Compilers"" ""Principles""",7,en,https://www.pearson.com/us/higher-education/program/Aho-Compilers-Principles-Techniques-and-Tools-2nd-Edition/PGM167067.html,"Compilers: Principles, Techniques, and Tools, 2nd Edition","Compilers: Principles, Techniques and Tools, known to professors, students, and developers worldwide as the ""Dragon Book,"" is available in a new edition. Every chapter has been completely revised to reflect developments in software engineering, programming languages, and computer architecture that ..."
"""Compilers"" ""Principles""",8,en,"http://ce.sharif.edu/courses/94-95/1/ce414-2/resources/root/Text%20Books/Compiler%20Design/Alfred%20V.%20Aho,%20Monica%20S.%20Lam,%20Ravi%20Sethi,%20Jeffrey%20D.%20Ullman-Compilers%20-%20Principles,%20Techniques,%20and%20Tools-Pearson_Addison%20Wesley%20(2006).pdf","PDF Compilers: Principles, Techniques, and Tools - Sharif","Compilers Second Edition Principles, Techniques, & Tools Alfred V. Aho Columbia University Monica S. Lam Stanford University Ravi Sethi Avaya Jeffrey D. Ullman"
"""Compilers"" ""Principles""",9,en,http://www.informatik.uni-bremen.de/agbkb/lehre/ccfl/Material/ALSUdragonbook.pdf,PDF Compilers - informatik.uni-bremen.de,"Compilers Principles, Techniques, & Tools Second Edition Alfred V. Aho Columbia University Monica S. Lam Stanford University Ravi Sethi Avaya Jeffrey D. Ullman Stanford University Boston San Francisco New York London Toronto Sydney Tokyo Singapore Madrid Mexico City Munich Paris Cape Town Hong Kong Montreal"
"""Compilers"" ""Principles""",10,en,http://turbo51.com/download/Compilers-Principles-Techniques-and-Tools-Book-Preview.pdf,"PDF Compilers - Principles, Techniques, and Tools - turbo51.com","issues in computer architecture and programming-language principles. Chapter 2 develops a miniature compiler and introduces many of the impor- tant concepts, which are then developed in later chapters. The compiler itself appears in the appendix. Chapter 3 covers lexical analysis, regular expressions, finite-state machines, and"
"""Compilers"" ""Principles""",11,en,https://www.beginnersheap.com/compilers-principles-techniques-and-tools-by-alfred-v-aho-pdf-download/,"Compilers: Principles, Techniques, and Tools By Alfred V. Aho ...","Download Compilers: Principles, Techniques, and Tools PDF eBook free. The ""Compilers: Principles, Techniques, and Tools 1st Edition"" is a good reference for anyone who wants to build the compiler. Compilers: Principles, Techniques, and Tools By Alfred V. Aho PDF Book Review ""Compilers ..."
"""Compilers"" ""Principles""",12,en,https://www.abebooks.com/9780321486813/Compilers-Principles-Techniques-Tools-2nd-0321486811/plp,"9780321486813: Compilers: Principles, Techniques, and Tools ...","Compilers: Principles, Techniques and Tools, known to professors, students, and developers worldwide as the ""Dragon Book,"" is available in a new edition.Every chapter has been completely revised to reflect developments in software engineering, programming languages, and computer architecture that have occurred since 1986, when the last edition published."
"""Compilers"" ""Principles""",13,en,https://rover.ebay.com/rover/1/711-53200-19255-0/1?icep_ff3=2&pub=5574933636&toolid=10001&campid=5336728181&customid=&mpre=https%3A%2F%2Fwww%2Eebay%2Ecom%2Fbhp%2Fcompilers-principles-techniques-and-tools,"Compilers: Principles, Techniques, and Tools | eBay","Compilers: Principles Techniques and Tools (International Edition) by Alfred V. Aho A copy that has been read, but remains in excellent condition. Pages are intact and are not marred by notes or highl..."
"""Compilers"" ""Principles""",14,en,"https://github.com/germanoa/compiladores/blob/master/doc/ebook/Compilers%20Principles,%20Techniques,%20and%20Tools%20-%202nd%20Edition%20-%20Alfred%20V.%20Aho.pdf","PDF compiladores/Compilers Principles, Techniques, and Tools ...","germanoa / compiladores. Sign up ... compiladores / doc / ebook / Compilers Principles, Techniques, and Tools - 2nd Edition - Alfred V. Aho.pdf. Find file Copy path phpmorales Adicionando material de estudo 30eab44 Nov 17, 2013. 1 contributor."
"""Compilers"" ""Principles""",15,en,https://pdfs.semanticscholar.org/b7ec/eec1e8edfa769fdd095db16897a061b02a79.pdf,PDF Compilers Principles Techniques And Tools 2nd Edition,"Compilers, principles, techniques, and tools / Alfred V. Aho, ... A feature of the new edition is that there is an ... Besides compilers, the principles and ..."
"""Compilers"" ""Principles""",16,en,https://github.com/fool2fish/dragon-book-exercise-answers,GitHub - fool2fish/dragon-book-exercise-answers: Compilers ...,"Compilers Principles, Techniques, & Tools (purple dragon book) second edition exercise answers. 编译原理（紫龙书）第2版习题答案。 - fool2fish/dragon-book-exercise-answers"
"""Compilers"" ""Principles""",17,en,https://suif.stanford.edu/dragonbook/lecture-notes.html,"Compilers: Principles, Techniques, and Tools (Dragon Book)","Compilers: Principles, Techniques, and Tools: These course lecture notes supplement topics from each textbook chapter: Lexical Analysis (Chapter 3) Intro. to lexical analysis [3] Implementing a lexical analyzer [3] Lexical analysis [5] Syntax Analysis (Chapter 4)"
"""Compilers"" ""Principles""",18,en,https://www.abebooks.com/servlet/SearchResults?isbn=0321486811,"0321486811 - Compilers: Principles, Techniques, and Tools 2nd ...","Compilers: Principles, Techniques, and Tools (2nd Edition) by Alfred V. Aho , Monica S. Lam , Ravi Sethi , Jeffrey D. Ullman and a great selection of related books, art and collectibles available now at AbeBooks.com."
"""Compilers"" ""Principles""",19,en,https://lagunita.stanford.edu/courses/Engineering/Compilers/Fall2014/about,Compilers | Stanford Lagunita,"However, you may find a textbook useful as a reference or to learn more details of some of the ideas discussed in the course. There are a number of good textbooks on compilers; here are three in particular: Compilers: Principles, Techniques, and Tools (Second Edition) Alfred Aho, Monica Lam, Ravi Sethi, and Jeffrey Ullman. Addison-Wesley"
"""Compilers"" ""Principles""",20,en,https://www.barnesandnoble.com/w/compilers-alfred-v-aho/1100866477,"Compilers: Principles, Techniques, and Tools / Edition 2 by ...","He has held teaching positions at Pennsylvania State university and the University of Arizona, and has taught at Princeton University and Rutgers. Dr. Sethi is co-author of the ""dragon book"", Compilers: Principles, Techniques and Tools and has written numerous articles. His books have been translated in Japanese, German, French, Italian ..."
"""Compilers"" ""Principles""",21,en,http://infolab.stanford.edu/~ullman/dragon/errata.html,"Errata for Compilers: Principles, Techniques, and Tools ...","Errata for Compilers: Principles, Techniques, and Tools, Second Edition This errata sheet applies to all printings. For printings prior to Spring, 2008, please see The First Errata Sheet ."
"""Compilers"" ""Principles""",22,en,https://www.isi.edu/~pedro/Teaching/CSCI565-Spring15/Materials/Dragon-Chapter2.pdf,"PDF Compilers: Principles, Techniques, and Tools, Second Edition ...","Compilers: Principles, Techniques, and Tools, Second Edition, by Alfred V. Aho, Monica S. Lam, Ravi Sethi, and Jeffrey D. Ullman. CHAPTER TOR j i t a of A is a a for The the for the b with p op erator TOR TOR. TOR TOR TOR. TOR tion tion ULE TION TOR"
"""Compilers"" ""Principles""",23,en,https://ocw.mit.edu/courses/electrical-engineering-and-computer-science/6-035-computer-language-engineering-spring-2010/lecture-notes/MIT6_035S10_lec01.pdf,"PDF 6.035 Lecture 1, Introduction - MIT OpenCourseWare","• Compilers: Principles Techniques and Tools (Dragon book) optimizations; very complete an suited for industrial practitioners and researchers. Principles, Techniques Tools (Dragon Th l i il t tb k Aho, Lam, Sethi and Ullman Addison-Wesley, 2006 ISBN 0321486811 The classic compilers textbook, although its front-end emphasis"
"""Compilers"" ""Principles""",24,en,https://www.pdfdrive.com/compiler-principles-techniques-and-tools-e6708003.html,"Compiler Principles, Techniques and Tools by Aho... - PDF Drive","Compilers - Principles, Techniques, and Tools 2e.pdf. 1,038 Pages·2007·48.24 MB·12,583 Downloads. Compilers. Second Edition. Principles, Techniques, & Tools."
"""Compilers"" ""Principles""",25,en,https://github.com/germanoa/compiladores/blob/master/doc/ebook/Compilers%20Principles%2C%20Techniques%2C%20and%20Tools%20-%202nd%20Edition%20-%20Alfred%20V.%20Aho.pdf,"PDF compiladores/Compilers Principles, Techniques, and Tools - 2nd...","compiladores/doc/ebook/Compilers Principles, Techniques, and Tools - 2nd Edition - Alfred V. Aho.pdf."
"""Java Platform""",1,en,https://www.guru99.com/java-platform.html,What is Java Platform? Ultimate Guide for Programmers,"Java platform is a collection of programs that help to develop and run programs written in the Java programming language. Java platform includes an execution engine, a compiler, and a set of libraries. JAVA is platform-independent language. It is not specific to any processor or operating system ..."
"""Java Platform""",2,en,https://en.wikipedia.org/wiki/Java_(software_platform),Java (software platform) - Wikipedia,"Platform. The Java platform is a suite of programs that facilitate developing and running programs written in the Java programming language. A Java platform will include an execution engine (called a virtual machine), a compiler and a set of libraries; there may also be additional servers and alternative libraries that depend on the requirements."
"""Java Platform""",3,en,https://www.oracle.com/java/,Java Software | Oracle,"Java Platform, Enterprise Edition. Maximize choice and minimize risk; develop scalable services for mobile and web applications. Java EE, with many commercial and open source implementations, is the enterprise standard defined by the community to build scalable business services that feed ..."
"""Java Platform""",4,en,https://www.oracle.com/technetwork/java/javase/downloads/index.html,Java SE - Downloads | Oracle Technology Network | Oracle,A powerful integrated development environment for developing applications on the Java platform. Oracle Java Advanced Management Console Advanced Management Console (AMC) enables desktop administrators to track and manage Java usage across their organization -- understanding which Java versions ...
"""Java Platform""",5,en,https://developer.ibm.com/components/java-platform/,Java Platform - IBM Developer,"Java Java Platform In Java 8, lambda expressions are treated as a type of functional interface. Learn how this design decision supports backward compatibility with older versions of the language, then see examples of both custom and built-in functional interfaces in a Java program."
"""Java Platform""",6,en,https://www.javaworld.com/category/java-platform/,"Java Platform information, news, and how-to advice | JavaWorld","Java 101: Learn Java from the ground up If you're new to Java then you've come to the right place. Get an overview of the Java platform, then code your first application using Java 12 and the new Java Shell"
"""Java Platform""",7,en,https://en.wikibooks.org/wiki/Java_Programming/The_Java_Platform,"The Java platform - Wikibooks, open books for an open world","The Java platform is the name given to the computing platform from Oracle that helps users to run and develop Java applications. The platform does not just enable a user to run and develop a Java application, but also features a wide variety of tools that can help developers work efficiently with the Java programming language."
"""Java Platform""",8,en,http://www.oldversion.com/windows/java-platform/,Download Old Versions of Java Platform for Windows ...,"OldVersion.com provides free software downloads for old versions of programs, drivers and games. So why not downgrade to the version you love?.... because newer is not always bett"
"""Java Platform""",9,en,https://java.com/en/download/help/java_crash_video_driver.xml,Error message: Java Platform SE Binary has stopped working,"When I try to run a Java based application, eg: Minecraft, I receive a message dialog: ""Java(TM) Platform SE binary has stopped working. A problem caused the program to stop working correctly."". This message is accompanied with the application becoming unresponsive."
"""Java Platform""",10,en,https://docs.oracle.com/javase/8/docs/api/,Java Platform SE 8 - docs.oracle.com,"This document is the API specification for the Java™ Platform, Standard Edition."
"""Java Platform""",11,en,https://docs.oracle.com/javase/8/docs/technotes/guides/index.html,Java™ Platform Overview - Oracle,"The Java Platform, Standard Edition provides two implementations of the Java virtual machine (VM): Java HotSpot Client VM. The client VM is an implementation for platforms typically used for client applications. The client VM is tuned for reducing start-up time and memory footprint."
"""Java Platform""",12,en,https://developer.ibm.com/articles/java-platform-getting-started/,Java Platform - IBM Developer,OpenJDK is the place to collaborate on an open source implementation of the Java Platform and related projects. OpenJDK offers the best open-source Java implementation and encourages external contributors to join the community.
"""Java Platform""",13,en,https://jdk.java.net/java-se-ri/11,"Java Platform, Standard Edition 11 Reference Implementations","Java Platform, Standard Edition 11 Reference Implementations. The official Reference Implementation for Java SE 11 () is based solely upon open-source code available from the JDK 11 Project in the OpenJDK Community.This Reference Implementation applies to both the Final Release of JSR 384 (Sep 2018) and Maintenance Release 1 (Mar 2019)."
