query,rank,language,url,title,snippet
"""Interrupt handler""",1,en,https://en.wikipedia.org/wiki/Interrupt_handler,Interrupt handler - Wikipedia,"In computer systems programming, an interrupt handler, also known as an interrupt service routine or ISR, is a special block of code associated with a specific interrupt condition. Interrupt handlers are initiated by hardware interrupts, software interrupt instructions, or software exceptions, and are used for implementing device drivers or transitions between protected modes of operation ..."
"""Interrupt handler""",2,en,https://www3.nd.edu/~lemmon/courses/ee224/web-manual/web-manual/lab7/node5.html,What is an Interrupt Handler?,What is an Interrupt Handler? Let's consider a program that the MicroStamp11 is executing. A program is a list of instructions that the micro-controller executes in a sequential manner. A hardware event is something special that happens in the micro-controller's hardware. An example of such an event is the RESET that occurs when pin 9 on the ...
"""Interrupt handler""",3,en,https://encyclopedia2.thefreedictionary.com/interrupt+handler,Interrupt handler | Article about interrupt handler by The ...,interrupt handler[′int·ə‚rəpt ‚hand·lər] (computer science) A section of a computer program or of the operating system that takes control when an interrupt is received and performs the operations required to service the interrupt. interrupt handler (software) A routine which is executed when ...
"""Interrupt handler""",4,en,http://www.tldp.org/LDP/lkmpg/2.6/html/x1256.html,Interrupt Handlers - tldp.org,"The way to implement this is to call request_irq() to get your interrupt handler called when the relevant IRQ is received. [2] This function receives the IRQ number, the name of the function, flags, a name for /proc/interrupts and a parameter to pass to the interrupt handler. Usually there is a certain number of IRQs available."
"""Interrupt handler""",5,en,https://ipfs.io/ipfs/QmXoypizjW3WknFiJnKLwHCnL72vedxjQkDDP1mXWo6uco/wiki/Interrupt_handler.html,Interrupt handler - ipfs.io,"An interrupt handler is a low-level counterpart of event handlers. Interrupt handlers are initiated by either hardware interrupts or software interrupt instructions and are used for servicing hardware devices and transitions between protected modes of operation, such as system calls. Overview"
"""Interrupt handler""",6,en,http://classweb.ece.umd.edu/enee447.S2016/ARM-Documentation/ARM-Interrupts-1.pdf,PDF Interrupt handling - classweb.ece.umd.edu,"The interrupt handler is the routine that is executed when an interrupt occurs and an ISR is a routine that acts on a particular interrupt. For instance, an ISR for a key being pressed might determine which key has been pressed and then assign a character that is then placed into a keyboard buffer (for later processing by the operating system)."
"""Interrupt handler""",7,en,https://docs.oracle.com/cd/E19253-01/816-4854/interrupt-15678/index.html,Chapter 8 Interrupt Handlers - Oracle,"Registering interrupt handlers provides the system with a way to associate an interrupt handler with an interrupt specification. The interrupt handler is called when the device might have been responsible for the interrupt. The handler has the responsibility of determining whether it should handle the interrupt and, if so, of claiming that ..."
"""Interrupt handler""",8,en,https://wiki.osdev.org/Interrupts,Interrupts - OSDev Wiki,"When an interrupt comes in, the IDT (which is setup by the OS in advance) is used to jump to code portion of the OS, which handles the interrupt (and therefore called the ""interrupt handler"" or ""Interrupt Service Routines"")."
"""Interrupt handler""",9,en,https://en.wikipedia.org/wiki/Interrupt,Interrupt - Wikipedia,"An interrupt alerts the processor to a high-priority condition requiring the interruption of the current code the processor is executing. The processor responds by suspending its current activities, saving its state, and executing a function called an interrupt handler (or an interrupt"
"""Interrupt handler""",10,en,https://www.sciencedirect.com/topics/computer-science/interrupt-handler,Interrupt Handler - an overview | ScienceDirect Topics,"9.3.1 NONNESTED INTERRUPT HANDLER. The simplest interrupt handler is a handler that is nonnested: the interrupts are disabled until control is returned back to the interrupted task or process. Because a nonnested interrupt handler can only service a single interrupt at a time, handlers of this form are not suitable for complex embedded systems ..."
"""Interrupt handler""",11,en,http://www.xml.com/ldd/chapter/book/ch09.html,"Linux Device Drivers, 2nd Edition: Chapter 9: Interrupt Handling","The interrupt handler can be installed either at driver initialization or when the device is first opened. Although installing the interrupt handler from within the module's initialization function might sound like a good idea, it actually isn't. Because the number of interrupt lines is limited, you don't want to waste them."
"""Interrupt handler""",12,en,https://embetronicx.com/tutorials/linux/device-drivers/linux-device-driver-tutorial-part-13-interrupt-example-program-in-linux-kernel/,Interrupt Example Program in Linux Kernel | EmbeTronicX,"When an interrupt handler is freed, dev provides a unique cookie to enable the removal of only the desired interrupt handler from the interrupt line. Without this parameter, it would be impossible for the kernel to know which handler to remove on a given interrupt line."
"""Interrupt handler""",13,en,http://www.tldp.org/LDP/lkmpg/2.4/html/x1210.html,Interrupt Handlers - Linux Documentation Project,"When the CPU receives an interrupt, it stops whatever it's doing (unless it's processing a more important interrupt, in which case it will deal with this one only when the more important one is done), saves certain parameters on the stack and calls the interrupt handler."
"""Interrupt handler""",14,en,https://www.computerhope.com/jargon/i/intehand.htm,What is an Interrupt Handler? - computerhope.com,"Interrupt handler Updated: 10/11/2017 by Computer Hope Alternatively referred to as a trap handler , an interrupt handler is a software routine performed when an interrupt is received by the computer."
"""Interrupt handler""",15,en,https://steamcommunity.com/app/370360/discussions/0/618463738396406342/,Interrupt handler :: TIS-100 General Discussions,"Interrupt handler This is frustrating. I simply cannot understand the goal for this puzzle. I have read and re-read the instructions, and I can't match the output with how I'm able to interpret the instructions. Can someone give me a kick in the right direction. What exactly is it asking me to do?"
"""Interrupt handler""",16,en,https://linux-kernel-labs.github.io/master/lectures/interrupts.html,Interrupts — The Linux Kernel documentation,Interrupt handler address¶ In order to find the interrupt handler address we first need to find the start address of the code segment where interrupt handler resides. For this we use the segment selector to index into GDT/LDT where we can find the corresponding segment descriptor. This will provide the start address kept in the 'base' field.
"""Interrupt handler""",17,en,https://www.embedded.com/design/prototyping-and-development/4023817/Interrupts-in-C-,Interrupts in C++ | Embedded,"In order for our static interrupt handler to manipulate instance data, we must have a stand-in. The this pointer to a given device interrupt class is stored in a static array in the Interrupt base class when Register is called. When a given interrupt occurs, the interrupt handler indexes into the array using the interrupt number, and calls the ..."
"""Interrupt handler""",18,en,http://users.ece.utexas.edu/~valvano/Volume1/E-Book/C12_Interrupts.htm,Chapter 12: Interrupts - users.ece.utexas.edu,This means an interrupt handler will be executed at fixed time intervals. This periodic interrupt will be essential for the implementation of real-time data acquisition and real-time control systems. For example if we are implementing a digital controller that executes a control algorithm 100 ...
"""Interrupt handler""",19,en,http://www.signal.uu.se/Staff/pd/DSP/Doc/ctools/apxc.pdf,PDF Interrupts C - Uppsala University,Interrupts C.1 INTRODUCTION The C Runtime Library provides function for supporting interrupts service routines written C. These functions install your C function as the interrupt handler for the designated interrupt. C.2 HARDWARE INTERRUPTS There are two types of interrupts that are supported in the ADSP-21xxx processors.
"""Interrupt handler""",20,en,https://www.sciencedirect.com/topics/engineering/interrupt-handling,Interrupt Handling - an overview | ScienceDirect Topics,"Peng Zhang, in Advanced Industrial Control Technology, 2010 (b) Interrupt handler. Interrupt handling is a key function in real-time software, and comprises interrupts and their handlers. Only those physical interrupts which of high enough priority can be centered into system interrupt table."
"""Interrupt handler""",21,en,https://everipedia.org/wiki/lang_en/Interrupt_handler/,Interrupt handler | Wiki | Everipedia,"Interrupt handler's wiki: In computer systems programming, an interrupt handler, also known as an interrupt service routine or ISR, is a special block of code associated with a specific interrupt condition. Interrupt handlers are initiated by hardware interrupts, software interrupt instructions, or software exceptions, and are used for implementing device drivers or transitions between ..."
"""Interrupt handler""",22,en,https://unix.stackexchange.com/questions/5788/how-is-an-interrupt-handled-in-linux,kernel - How is an Interrupt handled in Linux? - Unix & Linux ...,"The interrupt handler must run quickly, because it's preventing any other interrupt from running. In the Linux kernel, interrupt processing is divided in two parts: The ""top half"" is the interrupt handler. It does the minimum necessary, typically communicate with the hardware and set a flag somewhere in kernel memory."
"""Interrupt handler""",23,en,https://docs.oracle.com/cd/E19683-01/806-5222/interrupt-15678/index.html,Chapter 7 Interrupt Handlers (Writing Device Drivers),"To register a driver's interrupt handler, the driver usually performs the following steps in attach(9E).. Test for high-level interrupts by calling ddi_intr_hilevel(9F) to find out if the interrupt specification maps to a high-level interrupt.If it does, one possibility is to post a message to that effect and return DDI_FAILURE."
"""Interrupt handler""",24,en,https://www.techrepublic.com/article/writing-complex-interrupt-handlers-in-c/,Writing complex interrupt handlers in C - TechRepublic,"Writing complex interrupt handlers in C. ... little extra overhead in processing an ISR this way, but that overhead can be insignificant if you're writing a complex interrupt handler. Remember to ..."
"""Interrupt handler""",25,en,https://www.tutorialspoint.com/embedded_systems/es_interrupts,Embedded Systems - Interrupts - tutorialspoint.com,"An interrupt is a signal to the processor emitted by hardware or software indicating an event that needs immediate attention. Whenever an interrupt occurs, the controller completes the execution of the current instruction and starts the execution of an Interrupt Service Routine (ISR) or Interrupt Handler."
"""SQL injection""",1,en,https://www.w3schools.com/sql/sql_injection.asp,SQL Injection - W3Schools,"SQL in Web Pages. SQL injection usually occurs when you ask a user for input, like their username/userid, and instead of a name/id, the user gives you an SQL statement that you will unknowingly run on your database.. Look at the following example which creates a SELECT statement by adding a variable (txtUserId) to a select string."
"""SQL injection""",2,en,https://en.wikipedia.org/wiki/SQL_injection,SQL injection - Wikipedia,"SQL injection is a code injection technique, used to attack data-driven applications, in which malicious SQL statements are inserted into an entry field for execution (e.g. to dump the database contents to the attacker)."
"""SQL injection""",3,en,https://www.acunetix.com/websitesecurity/sql-injection/,What is SQL Injection (SQLi) and How to Prevent It,SQL Injection (SQLi) is a type of an injection attack that makes it possible to execute malicious SQL statements. These statements control a database server behind a web application. Attackers can use SQL Injection vulnerabilities to bypass application security measures.
"""SQL injection""",4,en,https://www.veracode.com/security/sql-injection,SQL Injection Cheat Sheet & Tutorial | Veracode,"What is SQL Injection? How will SQL Injection impact my business? How do I prevent SQL Injection? What is SQL Injection? SQL injection (SQLi) is an application security weakness that allows attackers to control an application's database - letting them access or delete data, change an application's data-driven behavior, and do other undesirable things - by tricking the application into ..."
"""SQL injection""",5,en,https://www.owasp.org/index.php/SQL_injection,SQL Injection - OWASP,"A SQL injection attack consists of insertion or ""injection"" of a SQL query via the input data from the client to the application. A successful SQL injection exploit can read sensitive data from the database, modify database data (Insert/Update/Delete), execute administration operations on the ..."
"""SQL injection""",6,en,https://docs.microsoft.com/en-us/sql/relational-databases/security/sql-injection,SQL Injection - SQL Server | Microsoft Docs,SQL Injection. 03/16/2017; 11 minutes to read +1; In this article. APPLIES TO: SQL Server Azure SQL Database Azure SQL Data Warehouse Parallel Data Warehouse SQL injection is an attack in which malicious code is inserted into strings that are later passed to an instance of SQL Server for parsing and execution.
"""SQL injection""",7,en,https://www.netsparker.com/blog/web-security/sql-injection-vulnerability/,What is SQL Injection & How to Prevent it | Netsparker,"Technical Explanation of SQL Injection Vulnerability. As the name suggests, an SQL injection vulnerability allows an attacker to inject malicious input into an SQL statement. To fully understand the issue, we first have to understand how server-side scripting languages handle SQL queries."
"""SQL injection""",8,en,https://www.csoonline.com/article/3257429/what-is-sql-injection-how-sqli-attacks-work-and-how-to-prevent-them.html,What is sql injection? How SQLi attacks work and how to ...,SQL injection is a type of attack that can give an adversary complete control over your web application database by inserting arbitrary SQL code into a database query.
"""SQL injection""",9,en,https://www.guru99.com/learn-sql-injection-with-practical-example.html,SQL Injection Tutorial: Learn with Example - Meet Guru99,"SQL Injection is an attack type that exploits bad SQL statements; SQL injection can be used to bypass login algorithms, retrieve, insert, and update and delete data. SQL injection tools include SQLMap, SQLPing, and SQLSmack, etc. A good security policy when writing SQL statement can help reduce SQL injection attacks."
"""SQL injection""",10,en,https://www.owasp.org/index.php/Testing_for_SQL_Injection_(OTG-INPVAL-005),Testing for SQL Injection (OTG-INPVAL-005) - OWASP,"Summary. An SQL injection attack consists of insertion or ""injection"" of either a partial or complete SQL query via the data input or transmitted from the client (browser) to the web application. A successful SQL injection attack can read sensitive data from the database, modify database data (insert/update/delete), execute administration operations on the database (such as shutdown the DBMS ..."
"""SQL injection""",11,en,https://www.netsparker.com/blog/web-security/sql-injection-cheat-sheet/,SQL Injection Cheat Sheet | Netsparker,SQL Injection Cheat Sheet What is an SQL Injection Cheat Sheet? An SQL injection cheat sheet is a resource in which you can find detailed technical information about the many different variants of the SQL Injection vulnerability.This cheat sheet is of good reference to both seasoned penetration tester and also those who are just getting started in web application security.
"""SQL injection""",12,en,https://www.techopedia.com/definition/4126/sql-injection,What is an SQL Injection? - Definition from Techopedia,SQL Injection: An SQL injection is a computer attack in which malicious code is embedded in a poorly-designed application and then passed to the backend database. The malicious data then produces database query results or actions that should never have been executed.
"""SQL injection""",13,en,https://www.youtube.com/watch?v=ciNHn38EyRc,Running an SQL Injection Attack - Computerphile - YouTube,Just how bad is it if your site is vulnerable to an SQL Injection? Dr Mike Pound shows us how they work. Cookie Stealing: https://youtu.be/T1QEs3mdJoc Rob Mi...
"""SQL injection""",14,en,https://www.php.net/manual/en/security.database.sql-injection.php,PHP: SQL Injection - Manual,"SQL Injection. Many web developers are unaware of how SQL queries can be tampered with, and assume that an SQL query is a trusted command. It means that SQL queries are able to circumvent access controls, thereby bypassing standard authentication and authorization checks, and sometimes SQL queries even may allow access to host operating system level commands."
"""SQL injection""",15,en,https://www.hacksplaining.com/exercises/sql-injection,SQL Injection - hacksplaining.com,"If you are vulnerable to SQL Injection, attackers can run arbitrary commands against your database. Ready to see how? Phew. Now we know how SQL injection works, let's learn how to protect against this kind of attack. This is the ..."
"""SQL injection""",16,en,https://stackoverflow.com/questions/601300/what-is-sql-injection,What is SQL injection? - Stack Overflow,"SQL injection is a fault in the application code, not typically in the database or in the database access library or framework. Most cases of SQL injection can be avoided by using query parameters. See How can I prevent SQL injection in PHP? for examples."
"""SQL injection""",17,en,https://www.youtube.com/watch?v=_jKylhJtPmI,Hacking Websites with SQL Injection - Computerphile,Websites can still be hacked using SQL injection - Tom explains how sites written in PHP (and other languages too) can be vulnerable and have basic security issues.
"""SQL injection""",18,en,https://www.checkmarx.com/knowledge/knowledgebase/SQLi,SQL Injection (SQLi) - Checkmarx,"SQL Injection, sometimes shortened to SQLi, is perhaps the most commonly employed hacking technique today, constantly making headlines and appearing in vulnerability reports. These malicious injections have been regularly starring in the OWASP Top-10 lists for years and they took the first place in ..."
"""SQL injection""",19,en,https://www.cloudflare.com/learning/security/threats/sql-injection/,SQL Injection | Cloudflare,"Structured Query Language (SQL*) Injection is a code injection technique used to modify or retrieve data from SQL databases. By inserting specialized SQL statements into an entry field, an attacker is able to execute commands that allow for the retrieval of data from the database, the destruction of sensitive data, or other manipulative behaviors."
"""SQL injection""",20,en,https://security.berkeley.edu/education-awareness/best-practices-how-articles/system-application-security/how-protect-against-sql,How to Protect Against SQL Injection Attacks | Information ...,"SQL injection is one of the most common web attack mechanisms utilized by attackers to steal sensitive data from organizations. While SQL Injection can affect any data-driven application that uses a SQL database, it is most often used to attack web sites. SQL Injection is a code injection technique that hackers can use to insert malicious SQL statements into input fields for execution by the ..."
"""SQL injection""",21,en,https://www.c-sharpcorner.com/UploadFile/0926bc/sql-injection/,SQL Injection - c-sharpcorner.com,SQL Injection is nothing but a combination of a SQL Query that can through user input from your website and execution of the query in your back-end database. I will give an example of the SQL injection. SQL Injection is just like an injection. In real life we use injection to take blood from our body or to insert a liquid into our body.
"""SQL injection""",22,en,http://www.sqlinjection.net/,SQL Injection - Understand and Prevent SQL Injection Attacks,"SQL injection attacks are gaining in popularity and it becomes really important for anyone working with databases to understand what this security issue is, how it works and how dangerous it can be."
"""SQL injection""",23,en,https://www.esecurityplanet.com/threats/how-to-prevent-sql-injection-attacks.html,How to Prevent SQL Injection Attacks - esecurityplanet.com,"SQL injection is a hacking technique that was discovered more than fifteen years ago and is still proving to be devastatingly effective today, remaining a top database security priority. It was ..."
"""SQL injection""",24,en,https://www.malwarebytes.com/sql-injection/,What is SQL Injection - SQLI Attack Examples & Prevention ...,"What is a SQL injection attack? You may not know what a SQL injection (SQLI) attack is or how it works, but you definitely know about the victims. Target, Yahoo, Zappos, Equifax, Epic Games, TalkTalk, LinkedIn, and Sony Pictures—these companies were all hacked by cybercriminals using SQL injections."
"""SQL injection""",25,en,http://www.unixwiz.net/techtips/sql-injection.html,SQL Injection Attacks by Example - Unixwiz.net,"A customer asked that we check out his intranet site, which was used by the company's employees and customers. This was part of a larger security review, and though we'd not actually used SQL injection to penetrate a network before, we were pretty familiar with the general concepts."
"""Plug-in"" ""computing""",1,en,https://en.wikipedia.org/wiki/Plug-in_%28computing%29,Plug-in (computing) - Wikipedia,"In computing, a plug-in (or plugin, add-in, addin, add-on, or addon) is a software component that adds a specific feature to an existing computer program. When a program supports plug-ins, it enables customization."
"""Plug-in"" ""computing""",2,en,https://mauriziolacava.com/vocabulary/plug-in-computing/,Plug-in (computing) - Maurizio La Cava: Lean Presentation ...,"In computing, a plug-in (or plugin) is a set of software components that adds specific abilities to a larger software application. If supported, plug-ins enable customizing the functionality of an application. For example, plug-ins are commonly used in web browsers to play video, scan for viruses, and display new file types."
"""Plug-in"" ""computing""",3,en,https://thenextweb.com/vocabulary/plug-in-computing/,"Plug-in (computing) - Latest news, opinion and analysis | The ...","In computing, a plug-in (or plugin) is a set of software components that adds specific abilities to a larger software application. If supported, plug-ins enable customizing the functionality of an ..."
"""Plug-in"" ""computing""",4,en,https://www.semanticscholar.org/topic/Plug-in-(computing)/59933,Plug-in (computing) - Semantic Scholar,"In computing, a plug-in (or plugin, add-in, addin, add-on, addon, or extension) is a software component that adds a specific feature to an existing computer program. When a program supports plug-ins, it enables customization. The common examples are the plug-ins used in web browsers to add new features such as search-engines, virus scanners, or the ability to use a new file type such as a new ..."
"""Plug-in"" ""computing""",5,en,https://wikimili.com/en/Plug-in_(computing),"Plug-in (computing) - WikiMili, The Free Encyclopedia","In computing, a plug-in (or plugin, add-in, addin, add-on, or addon) is a software component that adds a specific feature to an existing computer program. When a program supports plug-ins, it enables customization."
"""Plug-in"" ""computing""",6,en,http://wiki.gis.com/wiki/index.php/Plug-in_(computing),Plug-in (computing) - GIS Wiki | The GIS Encyclopedia,"Plug-in (computing) From wiki.gis.com ... The host application provides services which the plug-in can use, including a way for plug-ins to register themselves with the host application and a protocol for the exchange of data with plug-ins. Plug-ins depend on the services provided by the host ..."
"""Plug-in"" ""computing""",7,en,https://www.youtube.com/watch?v=Hzhu29Q4VTc,Plug-in (computing) | Wikipedia audio article - YouTube,"In computing, a plug-in (or plugin, add-in, addin, add-on, addon, or extension) is a software component that adds a specific feature to an existing computer program. When a program supports plug ..."
"""Plug-in"" ""computing""",8,en,https://infogalactic.com/info/Plug-in_(computing),Plug-in (computing) - Infogalactic: the planetary knowledge core,"In computing, a plug-in (or plugin, add-in, addin, add-on, addon, or extension) is a software component that adds a specific feature to an existing computer program. When a program supports plug-ins, it enables customization."
"""Plug-in"" ""computing""",9,en,http://www.thefullwiki.org/Plug-in_(computing),Plug-in (computing) - The Full Wiki,"From Wikipedia, the free encyclopedia. In computing, a plug-in (also called plugin, addin, add-in, addon, add-on, snap-in or snapin) consists of a computer program that interacts with a host application (a web browser or an email client, for example) to provide a certain, usually very specific, function ""on demand""."
