query,rank,language,url,title,snippet
"""Plug-in"" ""computing""",10,en,https://enacademic.com/dic.nsf/enwiki/14369,Plug-in (computing) - enacademic.com,"Plug-in (computing) A plug-in (plugin, addin, add-in, addon, add-on, snap-in or snapin; but see extension) is a computer program that interacts with a host application (a web browser or an email client, for example) to provide a certain, usually very specific, function ""on demand"".Applications support plugins for many reasons."
"""Plug-in"" ""computing""",11,en,http://portablecontacts.net/wiki/web-applications/plug-in-computing/,Plug-In (Computing) - portablecontacts.net,"In computing, a plug-in (or plugin, add-in, addin, add-on, addon, or extension) is a software component that adds a specific feature to an existing computer program. When a program supports plug-ins, it enables customization."
"""Plug-in"" ""computing""",12,en,https://wiki2.org/en/Plug-in_(computing),Plug-in (computing) - Wikipedia Republished // WIKI 2,"In computing, a plug-in (or plugin, add-in, addin, add-on, addon, or extension) is a software component that adds a specific feature to an existing computer program. When a program supports plug-ins, it enables customization."
"""Plug-in"" ""computing""",13,en,https://everything.explained.today/Plug-in_(computing)/,Plug-in (computing) explained,"Plug-in (computing) explained. In computing, a plug-in (or plugin, add-in, addin, add-on, or addon) is a software component that adds a specific feature to an existing computer program. When a program supports plug-ins, it enables customization. Web browsers have historically allowed executables as plug-ins, though they are now mostly deprecated."
"""Plug-in"" ""computing""",14,en,https://www.productivecomputing.com/filemaker-plugins/,FileMaker Plug-ins - Productive Computing,"Think of a FileMaker plug-in as a bunch of code wrapped up in a nice little package that allows your FileMaker app to talk with other third-party programs. Here at Productive Computing, we develop FileMaker plug-ins that push and pull data between FileMaker and a variety of applications ..."
"""Plug-in"" ""computing""",15,en,https://hyperleap.com/topic/Plug-in_(computing),Plug-in (computing) - hyperleap.com,"Plug-in (computing) plug-in plugin plugins plug-ins extension add-on add-ons add-in extensions browser plug-in. In computing, a plug-in (or plugin, add-in, addin, add-on, or addon) is a software component that adds a specific feature to an existing computer program.wikipedia."
"""Plug-in"" ""computing""",16,en,https://www.ibm.com/support/knowledgecenter/en/SSPLNP_10.2.3/com.ibm.swg.ba.cognos.ag_ccc.10.2.3.doc/t_ug_ccc_installation_pi_generic.html,Installing the Cognos Command Center plug-ins,"An IBM® Cognos® Command Center® plug-in is a set of task types and computing resources types that targets a specific technology or target system. About this task During the first installation of Cognos Command Center, a default set of plug-ins is installed in INSTALLDIR \Plugins and loaded into the repository."
"""Plug-in"" ""computing""",17,en,https://decisionstats.com/tag/plug-in-computing/,Plug-in (computing) - DECISION STATS,Tag: Plug-in (computing) Proxmate- Browser plugins for Proxy Surfing to sites closed to certain countries A neat technical innovation Proxmate is a browser plugin with a Chrome and Firefox version.
"""Plug-in"" ""computing""",18,en,https://www.youtube.com/watch?v=blLxfQ7bwaU,Plug-in (computing) - YouTube,"In computing, a plug-in (or plugin, extension, or add-on / addon) is a software component that adds a specific feature to an existing software application. When an application supports plug-ins ..."
"""Plug-in"" ""computing""",19,en,https://www.productivecomputing.com/quickbooks-filemaker-plugins/,QuickBooks plug-ins for FileMaker - Productive Computing,Learn how to integrate FileMaker and QuickBooks Desktop using the FM Books Connector plug-in with Productive Computing University's new course Connect FileMaker to QuickBooks Desktop This six-hour training course is intended for intermediate to advanced FileMaker developers and will step through the process of performing a basic FileMaker QuickBooks integration.
"""Plug-in"" ""computing""",20,en,http://dbpedia.org/page/Plug-in_(computing),About: Plug-in (computing) - DBpedia,"Property Value; dbo:abstract In computing, a plug-in (or plugin, add-in, addin, add-on, addon, or extension) is a software component that adds a specific feature to an existing computer program."
"""Plug-in"" ""computing""",21,en,https://en.wikipedia.org/wiki/Plug-in_(computing),Plug-in (computing) - Wikipedia,"In computing, a plug-in (or plugin, add-in, addin, add-on, or addon) is a software component that adds a specific feature to an existing computer program. When a program supports plug-ins, it enables customization."
"""Plug-in"" ""computing""",22,en,http://test.academic.ru/dic.nsf/enwiki/14369,Plug-in (computing) | Academic Dictionaries and Encyclopedias,"Plug-in — For the term plug in , see* Plug in (computing), an auxiliary computer program * Plug in hybrid electric vehicle * Plugging in (algebra), a mathematical procedure in which substitutions are..."
"""Plug-in"" ""computing""",23,en,https://frvid.com/w/plug+in+computing,Plug In Computing,"In computing, a plug-in (or plugin, extension, or add-on / addon) is a software component that adds a specific feature to an existing software application."
"""Plug-in"" ""computing""",24,en,https://trclips.com/rev/plug+in+computing/,Plug In Computing,"In computing, a plug-in (or plugin, extension, or add-on / addon) is a software component that adds Plug & Play (PnP) was a standard introduced in the early 90s to help allocate computer resources..."
"""Plug-in"" ""computing""",25,en,https://de-vid.com/w/plug+in+computing,Plug In Computing | DE-vid,"In computing, a plug-in (or plugin, extension, or add-on / addon) is a software component that adds a In this video, Marc Larochelle, CEO of Productive Computing, discusses the new FileMaker 16..."
"""Rule of three"" ""C++ programming""",1,en,https://en.wikipedia.org/wiki/Rule_of_three_(C%2B%2B_programming),Rule of three (C++ programming) - Wikipedia,The rule of three and rule of five are rules of thumb in C++ for the building of exception-safe code and for formalizing rules on resource management.It accomplishes this by prescribing how the default members of a class should be used to accomplish this task in a systematic manner.
"""Rule of three"" ""C++ programming""",2,en,https://www.flipkart.com/rule-three-c-programming/p/itmdyr4pmhxfhw4x,Rule of Three (C++ Programming): Buy Rule of Three (C++ ...,"Rule of Three (C++ Programming) by unknown from Flipkart.com. Only Genuine Products. 30 Day Replacement Guarantee. Free Shipping. Cash On Delivery! Explore Plus. Login & Signup. More. Cart. Share. Rule of Three (C++ Programming) (English, Paperback, unknown)"
"""Rule of three"" ""C++ programming""",3,en,https://www.quora.com/What-exactly-is-Rule-of-3-in-C++?share=1,What exactly is 'Rule of 3' in C++? - Quora,"> What is The Rule of Three? Quora. Sign In. Rule Of Three. C++ (programming language) What exactly is ""Rule of 3"" in C++? Update Cancel. a d b y D a t a d o g H Q. c o m. Get deep insight into your Azure environment in real time. ... Rule of three (C++ programming) 276 views. Related Questions."
"""Rule of three"" ""C++ programming""",4,en,https://www.morebooks.de/store/pt/book/rule-of-three-c++-programming/isbn/978-613-1-37027-4,"Rule of Three (C++ Programming), 978-613-1-37027-4 ...","Rule of Three (C++ Programming), 978-613-1-37027-4, Please note that the content of this book primarily consists of articles available from Wikipedia or other free sources online. The rule of three (also known as the Law of The Big Three or The Big Three) is a rule of thumb in C++ that claims that if a class defines one of the following it should probably explicitly define all three ..."
"""Rule of three"" ""C++ programming""",5,en,http://www.seomastering.com/wiki/Rule_of_three_(C%2B%2B_programming),Rule of three (C++ programming) - Free SEO Analysis,The rule of three (also known as the Law of The Big Three or The Big Three) is a rule of thumb in C++ that claims that if a class defines one of the following it should probably explicitly define all three: destructor; ... The C++ Programming Language (3 ed.). Addison-Wesley. pp. 283-4.
"""Rule of three"" ""C++ programming""",6,en,https://www.gamedev.net/forums/topic/434793-rule-of-three/,Rule of Three - GDNet Lounge - GameDev.net,"An interesting Zahir effect: Ive been reading lately on these forums about the Rule of Three in C++ programming. Then, today, I was reading an article on MagicTheGathering.com, and it mentioned the Rule of Three (in the context of Magic card design). I smiled at the parallels with the C..."
"""Rule of three"" ""C++ programming""",7,en,https://goldenbowlmobile.com/the-rule-of-three-photography/,The Rule Of Three Photography - Goldenbowlmobile.com,"Rule of three (C++ programming), a rule of thumb about class method definitions Rule of three (computer programming), a rule of thumb about code refactoring Rule of three (mathematics), a method in arithmetic Rule of three (medicinal chemistry), a rule of thumb for lead-like compounds Rule of three (statistics), for calculating a confidence …"
"""Rule of three"" ""C++ programming""",8,en,https://www.reddit.com/r/cpp/comments/bevjl8/compilergenerated_functions_rule_of_three_and/,"Compiler-generated Functions, Rule of Three and Rule of Five","Discussions, articles and news about the C++ programming language or programming in C++."
"""Rule of three"" ""C++ programming""",9,en,https://www.internalpointers.com/post/c-rvalue-references-and-move-semantics-beginners,C++ rvalue references and move semantics for beginners ...,"Wikipedia - Rule of three (C++ programming) Stack Overflow - What are all the member-functions created by compiler for a class? Does that happen all the time? cplusplus.com - Copy constructors, assignment operators, and exception safe assignment Stack Overflow - What is the copy-and-swap idiom?"
"""Rule of three"" ""C++ programming""",10,en,https://tvtropes.org/pmwiki/pmwiki.php/RuleOfThree/RealLife,Real Life / Rule Of Three - TV Tropes,"In C++ programming, it is considered poor practice to define a destructor, copy constructor, or copy assignment operator without assigning the other two; this is actually called the ""rule of three"" in the thrilling world of C++ jargon."
"""Rule of three"" ""C++ programming""",11,en,http://www.cs.ubbcluj.ro/~iuliana/oop/Lectures/Lecture_3.pdf,PDF Object-Oriented Programming,Rule of three Static and friend elements Summary Overview 1 C++ programming language 2 Object-oriented programming (OOP) 3 Classes and objects in C++ 4 De ning classes 5 Object creation/destruction 6 Operator overloading 7 Rule of three 8 Static and friend elements 9 Summary 2/56
"""Rule of three"" ""C++ programming""",12,en,https://wiki2.org/en/Rule_of_three_(C%2B%2B_programming),Rule of three (C++ programming) — Wikipedia Republished // WIKI 2,The rule of three and rule of five are rules of thumb in C++ for the building of exception-safe code and for formalizing rules on resource management. It accomplishes this by prescribing how the default members of a class should be used to accomplish this task in a systematic manner.
"""Rule of three"" ""C++ programming""",13,en,https://hyperleap.com/topic/Rule_of_three_(C%2B%2B_programming),Rule of three (C++ programming),Constructor (object-oriented programming) - Copy constructor (C++) - Assignment operator (C++) - C++ - Exception safety - Resource The rule of three and rule of five are rules of thumb in C++ for the building of exception-safe code and for formalizing rules on resource management.wikipedia.
"""Rule of three"" ""C++ programming""",14,en,https://infogalactic.com/info/Rule_of_three_(C%2B%2B_programming),Rule of three (C++ programming) - Infogalactic: the planetary...,"The rule of three, rule of five, and rule of 0 are rules of thumb in C++ for the building of exception-safe code and for formalizing rules on resource management. It accomplishes this by prescribing how the default members of a class should be used to accomplish this task in a systematic manner."
"""Rule of three"" ""C++ programming""",15,en,https://linguazza.com/definition/rule+of+three,RULE OF THREE definition | Rule of three (C++ programming),"The Rule of Three (also Three-fold Law or Law of Return) is a religious tenet held by some Wiccans/Pagans and occultists. The Rule of Three has been compared by Karl Lembke to other ethics of reciprocity, such as the concept of karma in Dharmic religions and the Golden Rule."
"""Rule of three"" ""C++ programming""",16,en,https://scientific_en_ru.academic.ru/106210/rule_of_three,scientific_en_ru.academic.ru/106210/rule_of_three,Rule of three (C++ programming) — The rule of three (also known as the Law of The Big Three or The Big Three) is a rule of thumb in C++ that claims that if a class or struct defines one of the following it should probably explicitly define all threecite book last = Stroustrup… … Wikipedia.
"""Rule of three"" ""C++ programming""",17,en,http://reddi.wikidot.com/rule-of-three,Rule Of Three - Reddi Web | C++ programming,"Rule Of Three. Survival skills. Prioritizing needs. C++ programming. Class method definitions Law of The Big Three The Big Three - If a class defines one of three functions, it should probably explicitly define all three"
"""Rule of three"" ""C++ programming""",18,en,https://enacademic.com/dic.nsf/enwiki/4583095,Rule of three (C++ programming),"Rule of Three — may refer to: *Rule of three (medicine), judgement of likelihood of harm in drug trials. Abstraction principle (programming) — In software engineering and programming language theory, the abstraction principle (or the principle of abstraction) is a basic dictum that aims to reduce..."
"""Rule of three"" ""C++ programming""",19,en,https://www.semanticscholar.org/topic/Rule-of-three-%28C%2B%2B-programming%29/12376100,Rule of three (C++ programming) - Semantic Scholar,The rule of three and rule of five are rules of thumb in C++ for the building of exception-safe code and for formalizing rules on resource management. It accomplishes this by prescribing how the default members of a class should be used to accomplish this task in a systematic manner.
"""Rule of three"" ""C++ programming""",20,error,https://goods.kaypu.com/gi/RU/5266e27d477158f0c5aec78f/9786131370274/Rule%20of%20Three%20%28C%2B%2B%20Programming%29,9786131370274 Rule of Three (C++ Programming),
"""Rule of three"" ""C++ programming""",21,en,https://c.devhelping.com/article/17803813/Rule+of+three+in+C%2B%2B+programming,Rule of three in C++ programming - c++,"I'm implementing a trie class, and following the rule of three in C++: has both nondefault coppy constructor, assignment operator and the destructor. However the program still crashes. What's wrong with the code? class Trie {."
"""Rule of three"" ""C++ programming""",22,en,http://www.upcscavenger.com/wiki/rule_of_three/,Wiki: Rule of three - upcScavenger,"Rule of three (C++ programming), a rule of thumb about class method definitions Rule of three (medicinal chemistry), a rule of thumb for lead-like compounds Rule of three (statistics), for calculating a confidence limit when no events have been observed"
"""Write once""",1,en,https://en.wikipedia.org/wiki/Write_once_read_many,Write once read many - Wikipedia,"Write once read many (WORM) describes a data storage device in which information, once written, cannot be modified. This write protection affords the assurance that the data cannot be tampered with once it is written to the device."
"""Write once""",2,en,https://medical-dictionary.thefreedictionary.com/Write+once,Write once | definition of Write once by Medical dictionary,The release of Compliant Write Once media reportedly adds a third UDO media type to the existing Rewritable and True Write Once formats. Plasmon launches Compliant Write Once UDO media The recording surface of Write Once UDO media only permits data to be written a single time.
"""Write once""",3,en,https://beeware.org/,Write once. Deploy everywhere.— BeeWare,"Write once. Deploy everywhere. Write your apps in Python and release them on iOS, Android, Windows, MacOS, Linux, Web, and tvOS using rich, native user interfaces. Multiple apps, one codebase, with a fully native user experience on every platform."
"""Write once""",4,en,"https://en.wikipedia.org/wiki/Write_once,_run_anywhere","Write once, run anywhere - Wikipedia","Write once, run anywhere (WORA), or sometimes Write once, run everywhere (WORE), was a slogan created by Sun Microsystems to illustrate the cross-platform benefits of the Java language. Ideally, this meant that a Java program could be developed on any device, compiled into a standard bytecode, and be expected to run on any device equipped with a Java virtual machine (JVM)."
"""Write once""",5,en,https://encyclopedia2.thefreedictionary.com/Write+once%2c+run+anywhere,"Write once, run anywhere | Article about Write once, run ...","Impronto Developer Kit extends the core premise of Java - write once, run anywhere,"" says CTO and Rococo co-founder, Karl McCabe."
"""Write once""",6,en,https://www.thefreedictionary.com/Write+once,Write once - definition of Write once by The Free Dictionary,"Write once synonyms, Write once pronunciation, Write once translation, English dictionary definition of Write once. v. re·wrote , re·writ·ten , re·writ·ing , re·writes v. tr. 1. To write again, especially in a different or improved form; revise. 2. To put in a form..."
"""Write once""",7,en,https://acronyms.thefreedictionary.com/Write+Once%2c+Read+Occasionally,"Write Once, Read Occasionally - How is Write Once, Read ...","WORO - Write Once, Read Occasionally. Looking for abbreviations of WORO? It is Write Once, Read Occasionally. Write Once, Read Occasionally listed as WORO. Write Once, Read Occasionally - How is Write Once, Read Occasionally abbreviated? ... Write Once, Read Occasionally; Write once, run ..."
"""Write once""",8,en,https://www.hubstor.net/write-read-many-worm-compliant-storage/,What is Write Once Read Many (WORM) Compliant Storage ...,Write once read many compliant storage gives organizations a way to secure information in a form that no one can tamper with. This can happen with something as simple as a CD-R or with software-driven cloud storage. The choice of media often depends on the scale of the data. You can store a handful of documents on physical media without trouble.
"""Write once""",9,en,https://dzone.com/articles/write-once-deploy-anywhere,"Write Once, Deploy Anywhere - DZone Cloud","Write Once, Deploy Anywhere Check out the latest offering from Nutanix that makes their Xi Frame software an option in the hybrid cloud. ..."
"""Write once""",10,en,https://superuser.com/questions/771945/is-there-such-a-thing-as-a-worm-write-once-read-many-sd-memory-card-or-usb-fla,Is there such a thing as a WORM (write-once-read-many) SD ...,"Do you know if exists a write-once-read-many (aka: WORM) USB flash or SD memory? I need an electronic write once memory to meet law requirements for storing sensitive data, and I want an alternative to my actual solution of CD-R discs. I found that SanDisk produced some WORM SD card, but now this kind of card seems to be out of production."
"""Write once""",11,en,https://security.stackexchange.com/questions/96230/convenient-write-once-media-to-attach-to-a-computer-a-usb-stick-or-device,storage - Convenient Write Once Media to attach to a computer ...,"What is a convenient write once media to use with a Computer, preferably via the USB interface. I often see this use-case in several ways: I have a server whose logs need to be on a medium that ..."
"""Write once""",12,en,https://www.kpit.com/insights/adaptive-autosar-write-once-adopt-everywhere/,"Adpative Autosar - Write once, adopt everywhere","Adaptive AUTOSAR - Write once, adopt everywhere An agile way of working with Continuous Integration approach as the foundation. The software platforms we are dominantly using currently in the Automotive Industry are firmware based. The firmware is a binary running build for a bare-metal on a ..."
"""Write once""",13,en,https://encyclopedia2.thefreedictionary.com/write+once,Write once | Article about write once by The Free Dictionary,Find out information about write once. Storage media that can be written to but not erased. WORM and CD-R disks are examples. Contrast with rewritable. See WORM and CD-R Explanation of write once. Write once | Article about write once by The Free Dictionary.
"""Write once""",14,en,https://www.wolfram.com/universal-deployment-system/?source=nav,"Wolfram Universal Deployment System: Write Once, Deploy Anywhere","Wolfram Universal Deployment System ™ Write once, deploy anywhere. Made possible by Wolfram's unique technology stack, the Universal Deployment System (UDS) offers a dramatic change in the economics of software development by automating the process of deploying functionality across the diverse ..."
"""Write once""",15,en,https://write.as/,Write.as — Distraction-free blogging and writing platform,"Write once, publish everywhere Connect your accounts and publish to any of these platforms where your audience already waits. Or enable federation to let readers in the fediverse directly follow and interact with your blog."
"""Write once""",16,en,https://docs.microsoft.com/en-us/azure/storage/blobs/storage-blob-immutable-storage,Immutable storage for Azure Storage Blobs | Microsoft Docs,"Immutable storage for Azure Blob storage enables users to store business-critical data objects in a WORM (Write Once, Read Many) state. This state makes the data non-erasable and non-modifiable for a user-specified interval. Blob Objects can be created and read, but not modified or deleted, for the duration of the retention interval."
"""Write once""",17,en,https://medium.com/androiddevelopers/write-once-run-everywhere-tests-on-android-88adb2ba20c5,"Write Once, Run Everywhere Tests on Android - Android ...","At Google I/O this year, we launched AndroidX Test, part of Jetpack. Today we're happy to announce the release of v1.0.0 Final alongside Robolectric v4.0. As part of the 1.0.0 release, all of…"
"""Write once""",18,en,https://idioms.thefreedictionary.com/write+on,Write on - Idioms by The Free Dictionary,Definition of write on in the Idioms Dictionary. write on phrase. What does write on expression mean? Definitions by the largest Idiom Dictionary. ... Write on the Record; write on water; Write once; Write once; Write once; Write once CD; Write once CD; Write Once Memory; Write Once Read Many;
"""Write once""",19,en,https://translate.academic.ru/write%20once/ru/en/,translate.academic.ru/write once/ru/en,"Write once — may refer to: * Write once, run anywhere, a slogan for the cross platform benefits of Java * Write once (cache coherency), a write invalidate protocol in computer memory design * Write..."
"""Write once""",20,error,https://translate.academic.ru/write%20once%20CD/en/ru/,translate.academic.ru/write once CD/en/ru,
"""Write once""",21,en,https://howlingpixel.com/i-en/Write_once,Write once - Howling Pixel,"Write-once (cache coherency), a write-invalidate protocol in computer memory design. Write Once Read Many, computer storage that can be written to once, but read from multiple times."
"""Write once""",22,en,https://en.glosbe.com/en/en/write%20once,write once - definition - English,A write once optical recording medium and a method and apparatus for storing and recovering defect management information to and from the write once optical recording medium are provided.
"""Write once""",23,en,https://context.reverso.net/translation/english-french/write+once,write once - Translation into French - examples... | Reverso Context,When a write error occurs on a write once recording medium the recording medium is currently discarded. Lorsqu'une erreur d'écriture survient sur un support d'enregistrement non réinscriptible...
"""Write once""",24,error,https://www.youtube.com/watch?v=KvLg6kPGqdQ,"write Once, Run Melos - YouTube",
"""Write once""",25,en,https://en.wiktionary.org/wiki/write_once,write once - Wiktionary,"write once (not comparable). (computing) of a type of storage technology in which data, once written, cannot be erased or modified. WORM. PROM/programmable read-only memory."
"""Write"" ""once""",1,en,https://en.wikipedia.org/wiki/Write-once_(cache_coherence),Write-once (cache coherence) - Wikipedia,"In cache coherency protocol literature, Write-Once was the first MESI protocol defined. It has the optimization of executing write-through on the first write and a write-back on all subsequent writes, reducing the overall bus traffic in consecutive writes to the computer memory.It was first described by James R. Goodman in (1983)."
"""Write"" ""once""",2,en,https://en.wikipedia.org/wiki/Write_once_read_many,Write once read many - Wikipedia,"Write once read many (WORM) describes a data storage device in which information, once written, cannot be modified. This write protection affords the assurance that the data cannot be tampered with once it is written to the device."
"""Write"" ""once""",3,en,https://www.definitions.net/definition/Write-once,What does Write-once mean? - definitions.net,Definition of Write-once in the Definitions.net dictionary. Meaning of Write-once. What does Write-once mean? Information and translations of Write-once in the most comprehensive dictionary definitions resource on the web.
