query,rank,language,url,title,snippet
"""Java Platform""",14,en,https://blogs.oracle.com/java-platform-group/,"Oracle Blogs | Oracle Java Platform Group, Product Management ...","Oracle's Java SE offerings are constantly evolving to better address the need of our users. This blog is a great resource for information on the upcoming and recent changes including features, policies, and announcements related to the most used development platform in the world."
"""Java Platform""",15,en,https://jdk.java.net/java-se-ri/10,"Java Platform, Standard Edition 10 Reference Implementations","Java Platform, Standard Edition 10 Reference Implementations. The official Reference Implementation for Java SE 10 () is based solely upon open-source code available from the JDK 10 Project in the OpenJDK Community.The binaries are available under two different licenses: The GNU General Public License version 2, with the Classpath Exception and the Oracle Binary Code License."
"""Java Platform""",16,en,https://java.com/en/download/faq/whatis_java.xml,What is Java and why do I need it?,"The Java Runtime Environment (JRE) is what you get when you download Java software. The JRE consists of the Java Virtual Machine (JVM), Java platform core classes, and supporting Java platform libraries. The JRE is the runtime portion of Java software, which is all you need to run it in your Web browser. What is Java Plug-in software?"
"""Java Platform""",17,en,https://www.tenforums.com/software-apps/79124-java-platform-se-binary-not-responding.html,Java Platform SE binary is not responding - Windows 10 Forums,"Java Platform SE binary is not responding Hi everyone, please be gentle with me as this is my first post and I presently know next to nothing about Java or Win10! I am trying to get my son's gaming console, which I just bought him used, to play Minecraft. Here are the facts:"
"""Java Platform""",18,en,https://blogs.oracle.com/java-platform-group/java-se-8-is-available-for-download,Java SE 8 is available for download | Oracle Java Platform ...,"Developers and system administrators can now download the first official release of Java SE 8. This is the first major release since Java 7 (July 2011) and features significant improvements in speed, stability, and security. Complete details about Java SE 8 and launch events can be found at The Java ..."
"""Java Platform""",19,en,https://github.com/btraceio/btrace,"GitHub - btraceio/btrace: BTrace - a safe, dynamic tracing ...","btrace. A safe, dynamic tracing tool for the Java platform. Version. 1.3.11.2 (Release Page)NOTE: For the latest develop changes head to 'develop' branch. Quick Summary. BTrace is a safe, dynamic tracing tool for the Java platform."
"""Java Platform""",20,en,http://www.oldversion.com/windows/java-platform-1-6-0-10,Download Java Platform 1.6.0.10 for Windows - OldVersion.com,"OldVersion.com Points System. When you upload software to oldversion.com you get rewarded by points. For every field that is filled out correctly, points will be rewarded, some fields are optional but the more you provide the more you will get rewarded!"
"""Java Platform""",21,en,"https://en.wikipedia.org/wiki/Java_Platform,_Standard_Edition","Java Platform, Standard Edition - Wikipedia","Java Platform, Standard Edition (Java SE) is a computing platform for development and deployment of portable code for desktop and server environments. Java SE was formerly known as Java 2 Platform, Standard Edition (J2SE).. The platform uses Java programming language and is part of the Java software-platform family."
"""Java Platform""",22,en,https://download.cnet.com/s/java-platform-se-binary/,Java Platform Se Binary - download.cnet.com,"java platform se binary free download - Java SE Development Kit, Java 2 SE, Java 2 Platform, Standard Edition (J2SE) Development Kit (JDK) 5.0, and many more programs"
"""Java Platform""",23,en,https://encyclopedia2.thefreedictionary.com/Java+platform,Java platform | Article about Java platform by The Free ...,"Java platform The entire Java development and execution environment from Oracle. Originally developed by Sun, which Oracle acquired in 2010, Java programs are executed by a runtime engine (the Java Virtual Machine) that must be installed in the target computer."
"""Java Platform""",24,en,https://www.lynda.com/Java-tutorials/Java-Platform-Standard-Edition/503495/511467-4.html,"Java Platform, Standard Edition - lynda.com","Java Platform, Standard Edition (Java SE) lets you develop and deploy Java applications on desktops and servers, as well as in today's demanding embedded environments. Java offers the rich user interface, performance, versatility, portability, and security that today's applications require. For learning Java or for small business applications Java SE is the platform of choice."
"""Java Platform""",25,en,https://www.youtube.com/watch?v=J7Jwy4V4dnU,HOW TO FIX-Java platform se binary has stopped working,HOW TO FIX-Java platform se binary has stopped working Xenon The Fixer. Loading... Unsubscribe from Xenon The Fixer? Cancel Unsubscribe. Working... Subscribe Subscribed Unsubscribe 7.6K. Loading
